{
  "version": "1.0",
  "generatedAt": "2026-10-05T15:55:00Z",
  "corpus": {
    "transcribed": 447,
    "planned": 1511,
    "coveragePct": 29.6,
    "accountsUsed": [
      "aoye98",
      "47590488570",
      "48854385344",
      "33349790582",
      "30578719968",
      "41252723284"
    ]
  },
  "scales": [],
  "dimensions": [],
  "composites": [],
  "rules": [
    {
      "id": "R-MATCH-001",
      "scope": "matching",
      "advisory": true,
      "title": "婚恋画像：定义与固定输出格式",
      "when": "来访者问“我能找个什么样的 / 我的择偶定位”",
      "then": "当场输出一段“具体目标对象”的画像（城市/本地性+年龄差+身高体重+颜值+学历+职业/编制+收入+家庭结构与资产档+性格短板+婚恋诉求），并给出定性“你是他的心智首选/第一选择”。画像按用途分叉：找女朋友/找老婆的画像不同。",
      "confidence": "medium",
      "conflict": false,
      "evidence": [
        {
          "account": "aoye98",
          "aweme_id": "7649728311765060883",
          "quote": "画像我给您画的,你是他的心智首选。你是他的第一选择,这叫婚恋画像。"
        },
        {
          "account": "aoye98",
          "aweme_id": "7638583110027824447",
          "quote": "找个本地人,独生女,1米68,颜值普通人,体重110斤,专升本的学历……父母同一个央企退休,家里面A7.2。"
        },
        {
          "account": "aoye98",
          "aweme_id": "7640076462543867176",
          "quote": "年龄大个7岁,老北京人不要要求成六区的,找个……门头沟的,有户口的,然后别卡独生子……能卡个身高,别卡颜值。"
        },
        {
          "account": "47590488570",
          "aweme_id": "7657819230796181371",
          "quote": "找女人的这个画像和找老婆的这个画像也是完全不一样。"
        }
      ],
      "context": "field-observation",
      "scopeNote": "判定条件为从 8 例画像反推的 v1 假设（审计 P1-9）；单账号（aoye98）、2 条语料单元，待补连麦后复核。",
      "sources": {
        "transcripts": 2,
        "accounts": 1
      },
      "claimType": "market-norm"
    },
    {
      "id": "R-MATCH-002",
      "scope": "matching",
      "advisory": true,
      "title": "画像必须带“对方的短板”",
      "when": "生成可触达画像",
      "then": "每条画像都要附一个可接受短板（形象一般/不太会聊天/玩不到一块/偏胖/收入一般），并显式说明取舍（“它是一个翘翘板”）。",
      "confidence": "medium",
      "conflict": false,
      "evidence": [
        {
          "account": "aoye98",
          "aweme_id": "7649728311765060883",
          "quote": "找个土著,独生子,1米72,140斤,形象一般,房车全,211本硕,体制内的事业编,不太会聊天,这路子考不考虑?"
        },
        {
          "account": "aoye98",
          "aweme_id": "7640076462543867176",
          "quote": "性格内向一点,闷一点,不太会给女生提供情绪价值,这路子考不考虑?"
        },
        {
          "account": "aoye98",
          "aweme_id": "7636352944786509094",
          "quote": "不能要求情绪价值,不能要求外貌。胖一点,一米七八,一百八十斤。"
        },
        {
          "account": "aoye98",
          "aweme_id": "7636347544313793830",
          "quote": "在乡镇区办公务员。月收入6000到8000,玩不到一块,聊不到一块。但是有全款的房子。"
        }
      ],
      "claimType": "market-norm"
    },
    {
      "id": "R-MATCH-003",
      "scope": "matching",
      "advisory": true,
      "title": "心智首选（第一选择 / plan A）：定义、边界与确定性",
      "when": "判断来访者能否成为某类目标对象的第一顺位",
      "then": "目标类人群对你是「第一顺位」= 心智首选：①目标刚需画像包含你；②目标再加一档条件即不再选择你（边界测试）；③对方愿意公开关系（把名字写进主页/公开），即具备稳定性与确定性；④通过竞争池检验（比你小 7–8 岁的同画像对手）。反面信号：你不是他的第一选择 / 只是 B 选项 / 只适合谈恋爱不适合结婚。",
      "confidence": "medium",
      "conflict": false,
      "evidence": [
        {
          "account": "aoye98",
          "aweme_id": "7649728311765060883",
          "quote": "画像我给您画的,你是他的心智首选。"
        },
        {
          "account": "aoye98",
          "aweme_id": "7649728311765060883",
          "quote": "你是他的第一选择,这叫婚恋画像。"
        },
        {
          "account": "aoye28",
          "aweme_id": "7689107853549833513",
          "quote": "这个男生他能把你公开,他能把你的名字写到他的抖音主页,你是他的心智首选了。"
        },
        {
          "account": "aoye98",
          "aweme_id": "7633737013467843849",
          "quote": "大家连婚恋事实上你找的一定是,你是他的第一选择,这叫有稳定性,有确定性。"
        },
        {
          "account": "aoye28",
          "aweme_id": "7644976989006498425",
          "quote": "起码第一选择不是你。"
        },
        {
          "account": "aoye28",
          "aweme_id": "7645184614402779813",
          "quote": "可能互相都是对方的B选项,都不是对方的首选。"
        },
        {
          "account": "aoye98",
          "aweme_id": "7582669708646747411",
          "quote": "这就不是男人的首选,谈恋爱没问题。"
        },
        {
          "account": "aoye98",
          "aweme_id": "7635221339149765926",
          "quote": "你不是让海王收心的心智首选。"
        }
      ],
      "standardRefs": [
        "S-HEIGHT-004"
      ],
      "claimType": "market-norm",
      "sources": {
        "transcripts": 7,
        "accounts": 1
      },
      "scopeNote": "核心概念跨 2 账号（aoye98 + aoye28）成立；「公开关系/稳定性确定性」为完整语料新增 критерий；判定公式仍为反推框架，不参与机器计分。（原 high 已按镜像剔除口径降为 medium。）",
      "sourcesNote": "按 evidence-independence 的镜像规则：账号集合同时含 aoye98 与 aoye28 时剔除 aoye28；本条有效账号=1（aoye98），虽有多内容单元，证据强度仍为 single-source。"
    },
    {
      "id": "R-MATCH-004",
      "scope": "matching",
      "advisory": true,
      "title": "竞争池检验：镜像版与小7-8岁对手",
      "when": "验证定位是否真实可执行",
      "then": "把「比你小 7–8 岁、同画像的女生」放进竞争池检验；镜像版（同层异性对照）经常是找不到的——即使 A8 家庭也会得到「门当户对可找不到、镜像版的你找不到」，因此镜像版只能作为对照，不是承诺。",
      "confidence": "medium",
      "conflict": false,
      "evidence": [
        {
          "account": "aoye98",
          "aweme_id": "7636008548790553907",
          "quote": "你的竞争对手,你怎么PK掉比你小七八岁的女生,02,03年的女生也能看上?"
        },
        {
          "account": "aoye98",
          "aweme_id": "7635221339149765926",
          "quote": "镜像版的你竞争力比咱强呀。"
        },
        {
          "account": "aoye98",
          "aweme_id": "7636347304823360806",
          "quote": "人家完全可以在身边找一个,就是02年,03年,不用985211,普通学历,普通工作,普通家境,普通收入。"
        },
        {
          "account": "aoye28",
          "aweme_id": "7689405478132124954",
          "quote": "门当户对可找不到啊,就镜像版的你找不到。"
        },
        {
          "account": "aoye28",
          "aweme_id": "7689107853549833513",
          "quote": "我很少画像会画镜像版的像。"
        }
      ],
      "standardRefs": [
        "S-MATCH-003"
      ],
      "claimType": "market-norm",
      "sources": {
        "transcripts": 5,
        "accounts": 1
      },
      "sourcesNote": "镜像剔除 aoye28 后有效账号=1（aoye98）；多内容单元但单账号，按 single-source 处理。"
    },
    {
      "id": "R-MATCH-005",
      "scope": "matching",
      "advisory": true,
      "title": "上限口径 = 天花板 / 极限",
      "when": "来访者问“我的上限/最高的能找什么样”",
      "then": "上限指你能触达的最优对象；表述为“就是你的天花板了”“绝对的上限”“极限”，并常附“我都怕这个路线你都拿不下”。",
      "confidence": "medium",
      "conflict": false,
      "evidence": [
        {
          "account": "aoye98",
          "aweme_id": "7637107374934838571",
          "quote": "独生子,无负债,能做到尊重女性,就是你的天花板了。……绝对的上限啊。"
        },
        {
          "account": "aoye98",
          "aweme_id": "7635580597229849866",
          "quote": "你要说咱现在的情况,极限啊……985本硕……A8.2,独生子……但是我都怕这个路线你都拿不下。"
        },
        {
          "account": "30578719968",
          "aweme_id": "7552245295359216905",
          "quote": "那您这上线非常高呀。"
        }
      ],
      "claimType": "market-norm"
    },
    {
      "id": "R-MATCH-006",
      "scope": "matching",
      "advisory": true,
      "title": "下限口径 = 保底底线清单",
      "when": "来访者问“我的下限/保底怎么定”",
      "then": "下限指不能再破的底线项（保底清单）。现场口径示例：保住颜值、保住学历、再保住体制内工作；对方须具备可验证的平等与尊重行为（尊重伴侣的职业规划与家务分工协商）、两性认知在线、非高冲突沟通风格。",
      "confidence": "medium",
      "conflict": false,
      "evidence": [
        {
          "account": "aoye98",
          "aweme_id": "7639325798792482102",
          "quote": "保住颜值,保住学历,再把体制内的工作保住,把他的道德品质的下限保住,他两性认知在线保住,他不女权,不强势。"
        }
      ],
      "claimType": "market-norm"
    },
    {
      "id": "R-MATCH-007",
      "scope": "matching",
      "advisory": true,
      "title": "三组二选一生成画像",
      "when": "目标过多、无法取舍",
      "then": "“体制内跟颜值你选一个,年龄跟情绪价值你选一个,家庭跟生活习惯你选一个,基本上这个画像就出来了。”选定保留项后，牺牲项自动落定。",
      "confidence": "medium",
      "conflict": false,
      "evidence": [
        {
          "account": "aoye98",
          "aweme_id": "7639325798792482102",
          "quote": "体质内跟颜值你选一个,年龄跟情价值你选一个,家庭跟生活习惯你选一个,基本上这个画像就出来了。"
        }
      ],
      "claimType": "market-norm"
    },
    {
      "id": "R-MATCH-008",
      "scope": "matching",
      "advisory": true,
      "title": "做减法：先撤可替换条件",
      "when": "条件叠加导致无解",
      "then": "撤掉“体制内/学历/户口/本地”等可替换条件再看（“把体制内拿了,把学历拿了,把户口拿了,不用非得找本地人”），剩下的是不可替换的硬核。",
      "confidence": "medium",
      "conflict": false,
      "evidence": [
        {
          "account": "aoye98",
          "aweme_id": "7636008548790553907",
          "quote": "把体制内拿了,把学历拿了,把户口拿了,不用非得找本地人吧?"
        },
        {
          "account": "aoye98",
          "aweme_id": "7639325798792482102",
          "quote": "我觉得这路子差不多,这两个你选一个,要不然你就做减法。"
        }
      ],
      "claimType": "market-norm"
    },
    {
      "id": "R-MATCH-009",
      "scope": "matching",
      "advisory": true,
      "title": "硬性项必须放弃其一（身高/颜值/性格/学历）",
      "when": "要求面面俱到、想要的人设全满",
      "then": "“没有人能找到完美的理想伴侣。想要结婚你就必须要放弃你在某方面的一个坚持。要么放弃身高,要么放弃颜值,要么放弃性格,要么放弃学历。”上探过高时，先问“你愿意在哪一点上面让步”。",
      "confidence": "high",
      "conflict": false,
      "evidence": [
        {
          "account": "47590488570",
          "aweme_id": "7628543138471080570",
          "quote": "没有人能找到完美的理想伴侣。想要结婚你就必须要放弃你在某方面的一个坚持。要么放弃身高,要么放弃颜值,要么放弃性格,要么放弃学历。"
        },
        {
          "account": "33349790582",
          "aweme_id": "7683765043494830437",
          "quote": "你必须得提前想清楚一件事情。你愿意在哪一点上面让步?"
        },
        {
          "account": "48854385344",
          "aweme_id": "7686470369087130932",
          "quote": "你要挑别人事业心重,那你就要接受他顾不上家。你要挑一个顾家的,你就得接受他的普通和平庸。"
        }
      ],
      "claimType": "market-norm"
    },
    {
      "id": "R-MATCH-010",
      "scope": "matching",
      "advisory": true,
      "title": "长板必带对应短板",
      "when": "评估或介绍某个人的条件组合",
      "then": "每个长板都对应一个短板：能提供高情绪价值的人往往敏感、情绪不稳；情绪稳定的人相对无趣；事业强的人顾不上家；性价高的画像必然有硬伤。",
      "confidence": "medium",
      "conflict": false,
      "evidence": [
        {
          "account": "aoye98",
          "aweme_id": "7638583110027824447",
          "quote": "能给你提供情绪价值的人,情绪都不稳定,情绪稳定的人,相对来说,带引号的,无趣一些。"
        },
        {
          "account": "48854385344",
          "aweme_id": "7686470369087130932",
          "quote": "挑一个他是顾家的吧,你就得接受他的普通和平庸啊,哪有啥两头都占的好事。"
        },
        {
          "account": "aoye98",